{
  "actor": "auto:test",
  "allow_tainted": false,
  "claude_argv": [
    "claude",
    "--settings",
    "/home/user/.local/state/claude-session/private/cs-aaaaaaaa/runs/1/settings.json",
    "--setting-sources",
    "",
    "--strict-mcp-config",
    "--add-dir",
    "/home/user/.local/state/claude-session/sessions/cs-aaaaaaaa",
    "--plugin-dir",
    "/opt/plugins/review-kit",
    "--add-dir",
    "/opt/plugins/review-kit",
    "--append-system-prompt-file",
    "/home/user/.local/state/claude-session/sessions/cs-aaaaaaaa/instructions.md",
    "--system-prompt-snapshot",
    "off",
    "-p",
    "--output-format",
    "stream-json",
    "--verbose",
    "--",
    "Your claude-session directory is /home/user/.local/state/claude-session/sessions/cs-aaaaaaaa. Read and follow /home/user/.local/state/claude-session/sessions/cs-aaaaaaaa/prompt.md"
  ],
  "config_hash_changed": null,
  "csession_id": null,
  "cwd": "/work/repo",
  "dry_run": true,
  "env_names": [
    "ANTHROPIC_API_KEY",
    "CLAUDE_CODE_TMPDIR",
    "CSESSION_DIR",
    "CSESSION_ID",
    "CSESSION_KIND",
    "GH_CONFIG_DIR",
    "GIT_CONFIG_COUNT",
    "GIT_CONFIG_GLOBAL",
    "GIT_CONFIG_KEY_0",
    "GIT_CONFIG_KEY_1",
    "GIT_CONFIG_KEY_2",
    "GIT_CONFIG_KEY_3",
    "GIT_CONFIG_KEY_4",
    "GIT_CONFIG_KEY_5",
    "GIT_CONFIG_NOSYSTEM",
    "GIT_CONFIG_VALUE_0",
    "GIT_CONFIG_VALUE_1",
    "GIT_CONFIG_VALUE_2",
    "GIT_CONFIG_VALUE_3",
    "GIT_CONFIG_VALUE_4",
    "GIT_CONFIG_VALUE_5",
    "GIT_OPTIONAL_LOCKS",
    "GLAB_CONFIG_DIR",
    "HOME",
    "PATH",
    "TMPDIR"
  ],
  "fork": false,
  "forked_from": null,
  "has_prompt": true,
  "hooks": [],
  "implicit_done": true,
  "input_files": [],
  "labels": [
    "kind=respond"
  ],
  "launch_kind": "respond",
  "max_turns": null,
  "mode": "headless",
  "origins": {
    "auto_exit": "builtin",
    "backstop": "builtin",
    "claude_args": "builtin",
    "cwd": "builtin",
    "env.allow": "builtin",
    "env.inherit": "builtin",
    "env.path_prepend": "builtin",
    "env.set_names": "builtin",
    "implicit_done": "builtin",
    "interactive_timeout": "builtin",
    "max_turns": "builtin",
    "mcp": "builtin",
    "model": "builtin",
    "notes_context": "builtin",
    "permission_profile": "builtin",
    "read_dirs": "config",
    "reads_third_party": "builtin",
    "sandbox": "builtin",
    "setting_sources": "builtin",
    "timeout": "builtin",
    "write_dirs": "builtin"
  },
  "override_escalation": false,
  "permission_profile": "respond",
  "profile": {
    "auto_exit": true,
    "backstop": true,
    "builtin": true,
    "claude_args": [],
    "cwd": "caller",
    "env": {
      "allow": [],
      "inherit": false,
      "path_prepend": [],
      "set_names": [
        "GIT_CONFIG_GLOBAL",
        "GIT_CONFIG_NOSYSTEM"
      ]
    },
    "fallback": false,
    "implicit_done": true,
    "interactive_timeout": null,
    "max_turns": null,
    "mcp": "none",
    "model": null,
    "name": "respond",
    "notes_context": false,
    "path": "/opt/claude-session/bin:/usr/bin:/usr/local/bin",
    "permission_profile": "respond",
    "read_dirs": [
      "/usr",
      "/bin",
      "/usr/bin",
      "/sbin",
      "/usr/sbin",
      "/lib",
      "/usr/lib",
      "/lib64",
      "/usr/lib64",
      "/etc",
      "/usr/local/bin",
      "/opt/claude/versions",
      "/opt/claude-session",
      "/opt/python/3.12",
      "/opt/toolchain"
    ],
    "reads_third_party": true,
    "required_env_names": [
      "ANTHROPIC_API_KEY",
      "GIT_CONFIG_GLOBAL",
      "GIT_CONFIG_NOSYSTEM"
    ],
    "sandbox": "required",
    "sandbox_available": true,
    "sandbox_problems": [],
    "setting_sources": [],
    "timeout": 3600.0,
    "warnings": [],
    "write_dirs": []
  },
  "repo": null,
  "run": 1,
  "run_kind": "respond",
  "sandbox": {
    "allow_read": [
      "/work/repo",
      "/home/user/.local/state/claude-session/sessions/cs-aaaaaaaa",
      "/usr",
      "/bin",
      "/usr/bin",
      "/sbin",
      "/usr/sbin",
      "/lib",
      "/usr/lib",
      "/lib64",
      "/usr/lib64",
      "/etc",
      "/usr/local/bin",
      "/opt/claude/versions",
      "/opt/claude-session",
      "/opt/python/3.12",
      "/opt/toolchain",
      "/opt/plugins/review-kit",
      "/work/main/.git",
      "/work/main/.git/worktrees/repo"
    ],
    "allow_write": [
      "/work/repo",
      "/home/user/.local/state/claude-session/sessions/cs-aaaaaaaa/outbox",
      "/home/user/.local/state/claude-session/sessions/cs-aaaaaaaa/artifacts",
      "/tmp/csession-1000/cs-aaaaaaaa"
    ],
    "available": true,
    "deny_read": [
      "/"
    ],
    "deny_write": [
      "/home/user/.local/state/claude-session/sessions/cs-aaaaaaaa/secret",
      "/home/user/.local/state/claude-session/sessions/cs-aaaaaaaa/prompt.md",
      "/home/user/.local/state/claude-session/sessions/cs-aaaaaaaa/prompts",
      "/home/user/.local/state/claude-session/sessions/cs-aaaaaaaa/instructions.md",
      "/home/user/.local/state/claude-session/sessions/cs-aaaaaaaa/run.json",
      "/home/user/.local/state/claude-session/sessions/cs-aaaaaaaa/inputs",
      "/home/user/.local/state/claude-session/sessions/cs-aaaaaaaa/gh-empty",
      "/home/user/.local/state/claude-session/sessions/cs-aaaaaaaa/empty-gitconfig",
      "/home/user/.local/state/claude-session/private",
      "/work/main/.git",
      "/work/main/.git/worktrees/repo",
      "/work/repo/.git",
      "/opt/plugins/review-kit",
      "/home/user/.local/state/claude-session/sessions/cs-aaaaaaaa/.claude",
      "/home/user/.local/state/claude-session/sessions/cs-aaaaaaaa/.mcp.json",
      "/home/user/.local/state/claude-session/sessions/cs-aaaaaaaa/CLAUDE.md",
      "/home/user/.local/state/claude-session/sessions/cs-aaaaaaaa/CLAUDE.local.md",
      "/work/repo/.claude",
      "/work/repo/.mcp.json",
      "/work/repo/CLAUDE.md",
      "/work/repo/CLAUDE.local.md"
    ],
    "mode": "required",
    "problems": []
  },
  "sandbox_lowered": false,
  "settings": {
    "hooks": {
      "Notification": [
        {
          "hooks": [
            {
              "command": "/opt/claude-session/bin/python3 -I -m claude_session hook-event --state-dir /home/user/.local/state/claude-session Notification",
              "timeout": 30,
              "type": "command"
            }
          ],
          "matcher": "permission_prompt"
        },
        {
          "hooks": [
            {
              "command": "/opt/claude-session/bin/python3 -I -m claude_session hook-event --state-dir /home/user/.local/state/claude-session Notification",
              "timeout": 30,
              "type": "command"
            }
          ],
          "matcher": "idle_prompt"
        },
        {
          "hooks": [
            {
              "command": "/opt/claude-session/bin/python3 -I -m claude_session hook-event --state-dir /home/user/.local/state/claude-session Notification",
              "timeout": 30,
              "type": "command"
            }
          ],
          "matcher": "elicitation_dialog"
        }
      ],
      "PermissionRequest": [
        {
          "hooks": [
            {
              "command": "/opt/claude-session/bin/python3 -I -m claude_session hook-event --state-dir /home/user/.local/state/claude-session PermissionRequest",
              "timeout": 30,
              "type": "command"
            }
          ]
        }
      ],
      "PostToolUse": [
        {
          "hooks": [
            {
              "command": "/opt/claude-session/bin/python3 -I -m claude_session hook-event --state-dir /home/user/.local/state/claude-session PostToolUse",
              "timeout": 60,
              "type": "command"
            }
          ]
        }
      ],
      "SessionEnd": [
        {
          "hooks": [
            {
              "command": "/opt/claude-session/bin/python3 -I -m claude_session hook-event --state-dir /home/user/.local/state/claude-session SessionEnd",
              "timeout": 30,
              "type": "command"
            }
          ]
        }
      ],
      "SessionStart": [
        {
          "hooks": [
            {
              "command": "/opt/claude-session/bin/python3 -I -m claude_session hook-event --state-dir /home/user/.local/state/claude-session SessionStart",
              "timeout": 30,
              "type": "command"
            }
          ]
        }
      ],
      "Stop": [
        {
          "hooks": [
            {
              "command": "/opt/claude-session/bin/python3 -I -m claude_session hook-event --state-dir /home/user/.local/state/claude-session Stop",
              "timeout": 60,
              "type": "command"
            }
          ]
        }
      ],
      "UserPromptSubmit": [
        {
          "hooks": [
            {
              "command": "/opt/claude-session/bin/python3 -I -m claude_session hook-event --state-dir /home/user/.local/state/claude-session UserPromptSubmit",
              "timeout": 30,
              "type": "command"
            }
          ]
        }
      ]
    },
    "permissions": {
      "allow": [
        "Bash",
        "Read",
        "Edit(//work/repo/**)",
        "Write(//work/repo/**)",
        "Agent",
        "Task",
        "Skill",
        "Bash(claude-session report:*)",
        "Bash(/opt/claude-session/bin/claude-session report:*)",
        "Read(//home/user/.local/state/claude-session/sessions/cs-aaaaaaaa/**)",
        "Edit(//home/user/.local/state/claude-session/sessions/cs-aaaaaaaa/artifacts/**)",
        "Write(//home/user/.local/state/claude-session/sessions/cs-aaaaaaaa/artifacts/**)",
        "Edit(//home/user/.local/state/claude-session/sessions/cs-aaaaaaaa/outbox/**)",
        "Write(//home/user/.local/state/claude-session/sessions/cs-aaaaaaaa/outbox/**)",
        "Read(//opt/plugins/review-kit/**)"
      ],
      "blockReadsOutsideWorkingDirectories": true,
      "defaultMode": "dontAsk",
      "deny": [
        "Bash(git push:*)",